,Unnamed: 0,Sentence,Label,Dataset
3846,5308,definition of have come to an '' ambitious failure '',1,train
4364,5525,You can where Big Love trying but it never quite gets .,2,train
4413,3182,"Recoing 's fantastic performance does n't exactly what tick , but perhaps any for it would have felt like a cheat .",2,train
2519,6466,The slapstick is labored and the setpieces flat .,0,train
2858,3326,"A believable , refreshingly low-key and quietly inspirational little drama .",3,train
3919,4990,Heavy with rolls of typical Toback machinations,1,train
3855,4249,Director Parker labors so life The Importance Being Earnest that he probably pulled a or .,2,train
3869,8274,I,2,train
2784,7301,He may have meant the Internet short Saving Ryan 's Privates,2,train
2629,5168,is a lumbering hokum but ... it at watchable .,1,train
2733,4386,"you may ask , why buy the movie milk when the TV is",1,train
3062,7986,devoted to the insanity of will good time .,3,train
4098,6183,"A film - a cross between Boys Do n't Cry , Deliverance and to - lies somewhere the story Matthew Shepard but that film is yet to be made .",2,train
2937,6601,Being latently and liking to read .,2,train
4251,2634,Aniston has at decisively broken with her image in an independent film satiric fire and emotional turmoil .,3,train
3306,2665,It is a likable story with competence .,3,train
2583,2055,What makes the special is its utter .,3,train
2841,5736,Another another gross-out college comedy -- ugh,0,train
3685,2322,enthralling documentary ... once playful and haunting in-depth portrait of an artist who unknowable even to friends .,4,train
4017,7176,Rather than of its underventilated re-fils confrontations .,1,train
4483,1618,Barbershop '' is a ensemble a variety of and an engaging .,3,train
2753,5526,Next is kind of that be by African-Americans because of its racial insensitivity towards .,1,train
4115,6739,"It is bad , certainly not without merit entertainment .",1,train
4497,6950,just that it 's so .,1,train
3066,5020,The opaque self-indulgent and just a movie as you can,1,train
4120,4303,"based , , and ill-wrought hypothesis .",1,train
3938,8488,", pretentious",1,train
3514,5954,"SC2 autopilot concoction lacking in imagination and authentic Christmas spirit , it geared toward an audience of of both",1,train
3890,3830,"Tends pile serious '' its plate at yet , always entertaining , and written",3,train
3324,7958,Nothing but an of Smackdown,1,train
2925,3426,The locations go stark desert to gorgeous beaches .,3,train
3202,2176,It 's probably worth visual merits,3,train
2648,3162,"It may low budget , this charmer has a spirit that not be .",3,train
3813,1444,Nachtwey clears the cynicism right of you .,2,train
4231,5740,instead go rent '' The Clown '' much funnier with a similar theme and equally Williams performance .,1,train
3996,5469,slasher aficionados things to like but the Halloween series lost its .,1,train
3651,5809,"True its animatronic ... as stiff , ponderous and as mechanical apparatus ... ' The Country Bears ' never out .",0,train
3541,1724,"The the curlers is n't interesting actually , what I like Men Brooms and what is of special film knows what unique quirky about .",3,train
2708,3783,"A all-star movie as unblinkingly pure as The Hours is rarity , an .",3,train
3371,752,Exudes fizz of Busby and visceral excitement of a sports extravaganza .,4,train
3409,2957,"Janice Beard in its recycled aspects implausibility , and in pace it rises in , and comedic employment .",3,train
3224,686,"pretty decent kid-pleasing , tolerable-to-adults a movie .",3,train
4043,6395,miserable and .,0,train
4035,5955,"After the big build-up the for audience as the characters is messy , , unsatisfying .",2,train
3646,7203,There 's not a idea at the core of this tale,1,train
2592,5950,"so low in poorly played of plot twists , idiotic court maneuvers and stupid n't save it",0,train
3596,8051,"It not a good , but is it a one .",2,train
4477,4232,"The direction , by George , has no snap to it , no wiseacre or hard-bitten",1,train
3078,4180,There 's no point in extracting the bones of Byatt 's for purposes of bland .,1,train
2888,4323,I sure the filmmakers found a and novel concept but anybody has ever an independent film can report that it instead clich .,0,train
2947,2244,"The trick when watching Godard is catch pitch of his savor the of his sounds and images and , philosophical , issues intersect .",3,train
2960,770,the cast alone will keep you watching as will the fight .,4,train
3279,1865,"relies on forced air on ss ' , clever ... and , script by Axel Hellstenius",4,train
2613,5490,found myself more appreciative of what the director trying than of he actually done .,2,train
3113,869,"'s head documentary , but one .",3,train
4184,1530,"A fantastic anchors this movie , but what it needs either a rigid , Blair Witch-style commitment to its mockumentary format , a more straightforward , dramatic treatment with the that implies .",2,train
3314,1307,Campanella gets the tone right -- funny in of sad in the hopeful .,3,train
3992,8475,Overwrought melodramatic bodice-ripper .,1,train
3756,343,"This movie becomes a soulful , incisive meditation the way were and we are",3,train
3847,296,Well cast and well directed powerful drama with enough sardonic wit keep it from maudlin .,4,train
3248,8145,"It a big , the itself is and shriveled .",1,train
3753,2285,"The on big with super-powers , their super-simple and their .",3,train
2534,2260,bubbles up out John C. Walsh 's Dream is distinct and very sense making a movie might to .,3,train
3963,5080,", if overly ...",2,train
2805,5720,'m guessing is a,3,train
4012,5049,With very little to add beyond the dark visions by like With Sharks and Player this latest skewering ... put off insiders and outsiders alike,1,train
3859,6693,We do n't need to very . ',1,train
3861,2034,", it to 's revelatory performance",3,train
3748,7446,we are given are simply too bland to be interesting .,1,train
3785,5780,"Distances by out so many red herrings so many false scares , that the genuine ones register .",0,train
2553,7149,With visible talent and no Hanks in bad need of major lessons and maybe a .,0,train
4076,7461,A culture comedy only half as clever is .,1,train
2791,1752,"Spider-man is than any summer blockbuster had to endure last summer , hopefully , sets a of good stuff .",4,train
4233,1234,"all-powerful , voice for a pop-cyber culture that feeds on her Bjorkness .",3,train
3139,7776,What gives ... is a man uses damage of war -- far more than the to the kind of art shots gallery shows,3,train
3876,2609,"Director Todd Solondz has about reaction to his two previous movies , and about responsibility to the characters he creates .",3,train
3750,241,... a triumph and narratively complex filmmaking .,4,train
3465,3263,"It 's adventure for you and all your mateys , regardless of their",4,train
3330,2292,"The asylum material , as the scenes of his .",4,train
3101,3743,An film about two itinerant and lost and desolate people they a place where war savaged the and liberties of poor and .,3,train
3567,5042,"An exercise , a florid but ultimately vapid melodrama with lots of surface flash little resonance",1,train
2608,436,This familiar rise-and-fall tale is on glamour larger consequences though it 's told with eyes the tenor of times .,3,train
3033,5367,"fragile upon which broad , mildly fleshed-out characters seem have been conjured 10 prior to filming",1,train
3111,5011,"If the movie all comedy , it better",2,train
3528,4209,A processed chop,1,train
2587,238,"with honest performances exceptional detail , Baran is a film with dramatic punch , a haunting ode .",4,train
3993,426,Real Have Curves its on its sleeve but even its are to swallow remarkable performances Ferrera Ontiveros,3,train
2654,4582,Low rent from one .,1,train
4345,1185,Wonderful fencing scenes and an exciting make this an eminently engrossing .,3,train
3412,410,"yarn , not quite a ripping .",3,train
2706,5396,Starts as an intense political and psychological thriller but is by ticking other cliches .,0,train
3190,5795,their heads were is anyone .,1,train
3240,1323,"An extremely funny , heartbreaking look at life in .",3,train
3593,6552,This letter is . .,2,train
3032,693,The plot twists give I Trying to Heart attraction desperately needed .,3,train
3118,7499,"An , guilt-suffused melodrama crippled by poor casting .",1,train
3561,5113,"Ignoring that , he Swimfan anyway",1,train
2650,8349,intoxicating experience,4,train
3327,4375,is an interesting movie,4,train
2618,1472,return pure Disney and is enjoyable family fare .,4,train
4247,4706,"It 's a stale , overused cocktail using the same olives since 1962 garnish",0,train
4020,4779,With Zoe Clarke-Williams 's lackluster thriller '' New '' who needs enemies,1,train
3516,6441,imponderably stilted self-consciously movie .,1,train
2542,2196,"this the of melodrama , the filmmaker cuts this natural grain producing a work 's interested in asking in them .",2,train
3586,603,'s lots of packed into ESPN 's Ultimate X.,3,train
3386,769,at absurdities and is part of fun .,3,train
3986,5708,is kind of movie simply because aims so low .,1,train
2510,4825,An on the feeble examples of big-screen Poke-mania that have preceded,3,train
3388,2250,"first Tunisian film I have ever seen , and it 's probably the most yet sensual entertainment likely to see all year .",4,train
3833,8308,"Long before it 's , you be thinking 51 to leave this loser",0,train
3038,1917,"At over an hour , Movie leave wanting , to leaving with smile on face .",4,train
3432,6050,Time stands still in ways one Clockstoppers a thriller lazy as is .,1,train
4094,907,knowing look at female friendship with urban humor,3,train
3105,5090,Might be one of those vanity in which filmmaker attempts show off his by surrounding himself untalented people .,2,train
4432,1883,What makes watching Quaid 's performance .,3,train
2589,2654,The courage its convictions performances side .,4,train
2934,116,In addition Hoffman powerful clinic this is that drama that thoughtful and rewarding glimpse into the sort of everyone has felt or will .,4,train
4376,4098,Our culture is down the toilet with the ferocity of a frozen burrito after an all-night tequila bender and know because I 've seen jackass movie . ',0,train
3391,6442,Muddled melodramatic paranormal romance is an all-time low for Kevin Costner .,0,train
3773,3011,"As averse as usually am to , follow-your-dream Hollywood fantasies this one got .",4,train
2948,6755,years 48 .,2,train
3089,8443,Punitively affirmational parable .,2,train
3711,5921,Uneven a spotty script add a biting no teeth .,1,train
3459,7441,Initial strangeness inexorably gives way to sentimentality and mystical becomes narrative expedience .,2,train
3725,7843,Perhaps the film should be seen conversation,2,train
3942,4854,The thing I were people who to see it .,1,train
4155,7684,"the end , you just care cold-hearted Petrovich that would Reno his comeuppance .",2,train
3485,4581,One in recent .,0,train
3444,5857,A cheap scam put together by some creeps at Revolution and Imagine to the surrender 93 of .,0,train
3637,6959,like old small-screen .,1,train
3429,2543,"Nicks level of exaggerated , throughout by taking your them just a .",3,train
4266,8254,The script is not cloying .,3,train
2962,4442,But the most part The Weight of Water off as a two-way that stalls its gear of emotional blandness .,1,train
4303,211,Perhaps best I 've ever seen .,4,train
3751,243,"Simply put , '' a masterpiece .",4,train
3835,6392,Wins ' The 2002 Enemy of Cinema Award .,2,train
4112,128,It 's not a great movie .,1,train
3308,2645,"Directed with purpose 's , makes the move from relatively lightweight such as Notting commercial with real thematic heft .",4,train
3809,1892,"overwrought and at times positively irritating , the turns into an engrossing thriller in spite of itself .",2,train
3198,4001,almost love story .,0,train
3772,2216,Schepisi 's tale of four Englishmen facing prospect of own mortality youthful as lost ideal but a point .,3,train
2761,8113,", and larded with exposition this somber cop drama feels as flat as the scruffy sands its titular community .",1,train
3354,5425,"teau would have been benefited from a sharper , cleaner before it went in front of camera",1,train
4422,2456,But fascinate in their .,3,train
3723,444,The hard-to-predict absolutely essential chemistry between the Bullock and proves to be sensational everything this elegant entertainment .,4,train
3052,8211,As saccharine as is disposable .,1,train
3881,2130,love the robust this picture .,4,train
4280,4829,"satire Lucky Break was aiming , it certainly got the '' section of the quirky rip-off prison romp pile .",1,train
2771,7335,a horrible could from one one the 's cinematic tragedies .,0,train
3180,4056,"Peralta , in luminous and evocative film from three ago the essence of the Dogtown experience .",4,train
4033,6188,it is in world that very very far from the of us inhabit .,2,train
2847,6543,story little and surprises .,1,train
4382,1853,film is about the rather than the outcome .,2,train
3245,7544,The movie does such excellent job of critiquing itself at half-step its like commiserating,1,train
2957,2815,play out realistically if not fairly .,3,train
2885,3873,If you to Mr. Reggio theory of imagery the 's it an of dislocation .,3,train
4315,7295,Whatever about warning kids about the dangers of ouija the same advice to film directors .,2,train
3226,3683,Does n't do expand a show to,1,train
4347,8040,", pity anyone who sees this",0,train
2900,2447,first ages that is n't fake fun .,3,train
3619,3981,"Each of these has the potential by an Angel and sappiness , but Thirteen One Thing , for all its and optimism , never resorts to easy feel-good .",4,train
3264,45,... sour movie at core of the the gaiety of the ... The film 's ending has a '' What was it all for,0,train
2516,1520,"A Angela Gheorghiu , Ruggero Raimondi and Roberto .",4,train
2756,8273,I n't .,1,train
4449,6275,"The filmmakers know how to , but it is not the prettiest pictures that tell best story",3,train
2899,5755,"have allowed to use the word new in its title because there not an original , or in the entire movie .",0,train
2906,8496,soulless .,0,train
4326,5212,is just too the 's does not live up to its style .,1,train
3831,7931,When endings were actually surprising,2,train
3909,5347,"The only to tolerate this insipid , clueless film might be with dose of painkillers",0,train
2674,1539,A very nailbiter .,3,train
2741,2021,fact and fancy with such confidence that we if we seeing something purer than the real,4,train
3616,6369,"... incredibly heavy-handed , that feels all familiar",0,train
4256,5375,It gets old quickly .,1,train
2501,7987,Feel free to get popcorn whenever he 's not onscreen .,0,train
2686,508,"Though will it ranks with the best Herzog 's works , Invincible shows he 's in form , an astoundingly",4,train
2790,6126,Fluffy hiding film references .,1,train
2871,4513,Suffers over-familiarity since hit-hungry filmmakers have strip-mined Monty formula mercilessly 1997 .,0,train
3782,2334,"Vera created , absorbing that reveals the of self-hatred instilled social mores .",3,train
2876,3220,"Engages us of , we ourselves surprised we about story , and up walking out only but also somewhat touched",4,train
2713,1008,Instead of hitting audience over the with a Schrader relies on subtle ironies devices to convey,3,train
3797,1152,", reverent , and subtly different sequel .",4,train
2804,4561,generating about as much chemistry as Iraqi factory to a UN inspector .,2,train
2798,6213,A family-friendly fantasy that little its premise,2,train
3778,4311,The results are far more than involving .,1,train
2694,2523,large-format film is well to in and IMAX sound lets you the beat your toes .,4,train
4146,6908,", I 'd rather watch them the Animal .",0,train
3318,3221,"a bilingual charmer , just the woman who inspired it",3,train
3131,1764,Close in spirit to its freewheeling be breath of fresh .,3,train
2712,8467,hash,2,train
4448,3,You 'd America would have had of plucky British eccentrics with of gold .,2,train
3287,3001,"Visually breathtaking , viscerally exciting , and dramatically moving 's very definition epic adventure",4,train
4051,3566,"is an accomplished , and is big , juicy role",3,train
3317,4451,from the train,1,train
3826,2421,The leanest and of misanthropic comedies .,3,train
3421,3012,seems to have a knack for wrapping the theater in a cold blanket of urban desperation .,1,train
3921,7247,"Elaborate special effects take centre screen , so that the is pushed to side",3,train
3627,5485,hard to quirky funny that the strain is all too .,0,train
4255,4353,One thing is This movie does not lot about Lily Chou-Chou .,2,train
4084,6026,", National Lampoon 's Van Son of Animal House",2,train
3819,656,Wedding feels bit,0,train
2863,2432,It 's to,3,train
4031,479,And they succeed merrily at their noble,3,train
2846,7467,After that it becomes tedious classroom in a course .,0,train
3424,2103,enjoyed as a work of by .,3,train
2959,61,An resonant gem relays its universal points lectures or confrontations ',3,train
3152,4856,hackneyed story affluent damsel who decides fight her bully of is simply too overdone .,1,train
2831,6047,"It goes down easy , aftertaste",3,train
4066,168,"often , Son the Bride an in trying to predict when '' big moment will occur and not '' . ''",1,train
4212,533,chilling tale of one of crimes Century murder of two rich women by their in .,3,train
3393,1923,"you love , I do , its to having more fun watching a documentary ...",4,train
2836,1683,looking a trashy,3,train
2952,2532,Sparkling hilarious romantic jealousy comedy Attal looks so much like young DeNiro it seems film should instead called ' Is Bickle ',4,train
4131,963,"At times a bit melodramatic and little dated depending upon where you live , Ignorant is good-natured not bad way to hour or .",3,train
4210,5730,Both deserve,1,train
4480,7868,"Throughout all the tumult , a question comes mind So is this so",1,train
4408,2610,"The that comes to , while watching Rohmer 's tribute to Scottish lady , painterly .",3,train
2874,2337,"While Hollywood will undoubtedly provide its keenest to familiar Bombay musicals , it also has for those like me who are n't .",3,train
2752,5436,Hollywood Ending very funny .,1,train
4092,7846,But it would be better to wait for,1,train
2843,3289,The story of '' Punch-Drunk Love may have worked the 's minimalist intent but it is interesting by talented director Anderson,3,train
3793,8389,Rewarding,3,train
3009,208,Cineasts revel in visual as film 's verbal pokes at everything the likes Weinstein 's bluff style to stylistic rigors of Denmark Dogma .,3,train
2749,4143,expect is what you get ... assuming the of expectations has been above height .,0,train
2514,7425,witty and sophisticated and want to love -- but Attal into corner .,1,train
3159,1639,pretty much delivers that promise .,3,train
2883,4901,The best thing be said of the picture that it does have a cute moments .,2,train
2917,6986,"The problem , , is screenplay .",1,train
3400,2640,the sensational purists might like and more storytelling less horrifying .,3,train
3697,1888,"Hatfield and Hicks oddest , and this sense movie becomes study of gambles of publishing world a case study that exists the movie 's political .",3,train
3844,6001,Impostor is a down for Gary Fleder .,1,train
2786,1818,An estrogen opera so feminine that serves as the to Diesel 's flex-a-thon,2,train
3278,778,The film is so convincing that by movies ' end you swear you are in places feel sand in,3,train
2518,3753,"IMAX in short , it 's just as wonderful the big .",4,train
4195,3810,"It an old Warner jived sex -- this could be Flynn always wanted to make , Bette Davis , cast Joan , would have killed him .",2,train
4328,29,n't a new .,1,train
4096,1821,It 's a ripper of a yarn and I for thrill of the,3,train
3980,8019,Charly comes off emotionally sadly imitative of past Story derisions .,1,train
3950,3324,"If very makes nervous ... you 'll have an of the , effectiveness .",2,train
2716,5092,Not one moment in enterprise did n't me lie in a dark room with cool brow .,2,train
3385,1102,"film 's messages of tolerance diversity particularly original , but one ca n't be drawn in by the sympathetic characters .",3,train
4372,2142,as black comedy -- Willie would have loved it .,4,train
3143,7328,"Welles groupie scholar Peter Bogdanovich a long time to do it , finally his own broadside at giant Randolph",3,train
3463,7422,This is busy all of its assigned marks to any of its .,1,train
2597,930,"... Pearce on hand to keep things on semi-stable dramatically retooled Machine effective enough at achieving the , crowd-pleasing goals it sets for itself .",4,train
3661,5731,-- that the ' true story by All the 's Men allegedly '' inspired '' a lot more deftly enacted 's cobbled together onscreen,1,train
3885,4045,"... sweetly affecting about four are coping , one way another with life endgame",3,train
2977,1684,Even these seven children seem at too many although in reality are not enough .,2,train
3827,4509,"The most memorable moment was when Green threw equipment at a window not because it was , but because I had serious urge grab the lady at the end of my aisle walker and toss it at the screen in .",0,train
3239,2590,Though a touch too Arthouse 101 in its poetic Heaven proves be a good match the sensibilities two directors .,3,train
3173,4081,but not compelling,2,train
3227,1769,"This not Chabrol , but even his lesser works outshine best can offer .",2,train
2779,3176,Robinson 's of suspense matches page-turning that Clancy creates .,4,train
2760,7329,"same mistake the music , becoming and watered-down it almost what made love the first .",1,train
3559,3951,combination of and the extraordinary technical of first film are but impact falls little with a storyline that never quite delivers the original magic .,2,train
4141,3628,is worth a its true-to-life characters acting its unadorned view of life and the of first-timer Hilary Birmingham .,4,train
3650,3460,It may ... work as a jaunt lane for teens and young adults who up on televised Scooby-Doo shows or reruns .,3,train
4240,8538,Well-made mush-hearted .,3,train
2887,8087,period story about a tries to help a friend get heaven by sending audience straight to hell .,0,train
3039,7298,"If routine action jokes like are cup , then 8 and get for big shear .",1,train
3042,5853,"It is depressing , ruthlessly depraved , the movie equivalent of staring into open wound",0,train
2988,2598,"A miraculous , Going is , yet with wisdom and emotion .",4,train
3168,4003,A of an alienated who re-invents himself .,3,train
3236,480,Melodrama with message,2,train
4309,7679,"Once the of laughter has been quashed by whatever is at hand , the funniest idea is funny",0,train
3936,7334,"Oversexed , at overwrought that little insight into the of being forty single .",0,train
3041,2899,"With Spy Kids The Island Dreams , Spy Kids franchise establishes itself as a durable part of the movie landscape a Bond series kids .",3,train
3353,5789,"ambitiously naturalistic , albeit half-baked drama about abused inner-city autistic teen .",3,train
2972,3218,"Presents a side of contemporary Chinese life that many surprised , does with an that smacks revelation .",3,train
3949,743,Nicole Kidman it a worth .,4,train
3235,1943,Craig Bartlett and director Tuck Tucker be illustrating the merits of fighting hard something that really matters,3,train
2527,4843,Kapur 's contradictory about his material in a that works against .,1,train
3537,5099,too contrived to be naturally charming it needs to .,1,train
3719,5547,urban comedy clearly not Zhang 's forte his directorial is neither nor magical enough to bring this kind of whimsy .,1,train
2880,4559,a bland yawner .,0,train
3411,3443,"Art-house to core , is a genre-curling story revives the free-wheeling of old French cinema .",3,train
2969,7584,Snipes relies much a scorchingly dramatic its own good,2,train
2898,5668,' Why ',2,train
3199,1658,A heroic tale persistence that is sure viewers ' .,4,train
3243,2197,"As a romantic , Kissing Jessica quirky , charming and often .",4,train
3704,3197,"may leaving their exposed , but the plot remains guarded as virgin with chastity .",1,train
2860,5419,is a where notable observation is how you 've been sitting .,1,train
3701,6144,"The script , with irksome characters .",1,train
4007,7492,Despite the holes in the story and the somewhat predictable plot moments of the movie caused me to my chair,2,train
3379,6095,This is not Jackie Chan movie .,1,train
2505,4280,"Bigelow handles the crisis evenly but milks drama when she should be building suspense , and drags out too many toward the that should move .",1,train
3333,4823,"Not really thriller so as a for teens to laugh , groan hiss at .",1,train
2750,2964,"But Kouyate elicits strong from his , he a powerful commentary on lie , runs them",3,train
2742,1870,The 's thesis -- elegant technology for the masses is surprisingly .,3,train
4245,4032,"But the performances Pacino , Williams , Swank the viewer all the way through",4,train
3792,2242,"Mike is n't to that makes Michael jealous , it has cute , funny scenes , and hits target audience young Bow - with nothing but net .",3,train
2754,3509,The understand and McCracken knows 's all that matters .,3,train
2684,406,It about the image,2,train
3335,1924,'s technique is to terror by suggestion rather than the of special effects .,3,train
3211,5232,"Too stagey , -- -- its own .",1,train
3229,5553,movie dawdle in classic disaffected-indie-film mode and brother 's stumbles over twist just n't make .,1,train
3106,7156,"A few energetic stunt briefly enliven the film , but the wheezing terrorist n't the stamina for the running time , and protagonists ' bohemian boorishness mars the spirit of good clean fun",2,train
