,Unnamed: 0,Sentence,Label,Dataset
1978,2360,"Angel portray events partially from the perspective of Aurelie and Christelle , and infuses the film with the sensitiveness of a particularly nightmarish fairy tale .",3,train
2063,7407,ampere moving picture to bury,1,train
2366,6813,descent short in excuse the medicine and its source .,2,train
37,3758,"easily , this moving picture proves you unseasonable on both depend .",1,train
505,5416,it 's impossible to indulge the imaginary castle in the air of Janice Beard Eileen Walsh when her real-life character is so charmless and vacant .,1,train
1266,2711,rarely have atomic number  seen a film so leave to champion the fallibility of the human being heart .,4,train
1798,6666,"There 's some upright stuff in their story about a retail clerk wanting more out of life , but the movie too oftentimes spins its rack with familiar situations and repetitive scenes .",1,train
832,3697,deoxyadenosine monophosphate charming and funny story of clashing cultures and a clashing bring forth girl family relationship .,2,train
2490,2936,"The Importance of represent Earnest , so fatheaded with wit it plays ilk a reading from Bartlett 's conversant Quotations",3,train
1475,6302,"pitiful gimcrack , this .",1,train
1293,7029,An incredibly irritating comedy about thoroughly hollow people ... manages to substantiate the worst excess of nouvelle shadowy without any of its sense of fun or energy .,0,train
207,953,one of the most truly sweet plastic film to total along in quite some time .,4,train
2034,5362,Jaglom declare oneself the none-too-original premise that everyone demand with movie making is a con creative person and a liar .,1,train
1735,8543,indiana this suit goose egg .,1,train
239,1081,thin but gratifying docudrama .,3,train
1992,371,poesy in question bewitch on motion picture show .,4,train
1905,5361,"Other than a mildly lock central solicit , hospital is sickly entertainment at best and mind-destroying cinematic pollution at pip .",0,train
117,5859,"homo Nature is a cuckoo film , in the way that Malkovich was , but it strain too hard .",3,train
2116,4672,An exhausting kin drama about a porcelain imperium and just as hard a flick as its open subject .,2,train
619,1408,"It 's a process -- a delightful , witty , improbable romantic comedy with a zippy jazzy score ... yield and steer give it look as though they are having so much fun .",4,train
876,3099,"The motion picture is an earnest try at beachcombing verismo , but it would be even more indistinct than it is were it not for the spectacular , quietly vulnerable personality of ms st ambrose .",1,train
512,6285,"'' outlandish friday , '' it 's not .",1,train
652,8432,amazingly dopy .,3,train
196,3739,Nothing forgetful of a chef doeuvre -- and a challenge ace .,4,train
1502,6350,"A miry version of ' Fatal Attraction ' for the teeny-bopper mark ... a sad , soggy potboiler that waste product the gift of its attractive young leads .",1,train
1035,1031,murder Spider-Man the movie from its blood red clupea harangus surroundings and it 's apparent that this is one summer flick that satisfies .,3,train
1626,2153,"As they used to sound out in the 1950s sci-fi flick , sign on is a tribute to Shyamalan 's gifts , which are such that we 'll keep watching the skies for his next jut out .",3,train
1446,5208,Cal is an unpleasantly shoal and immature case with whom to spend one hundred ten claustrophobic instant .,1,train
425,2275,"repel by a wonderful dual carrying into action from Ian Holm ... the film is rum , insightfully human and a delightful lark for history buffs .",4,train
532,5097,If only merchant pay up more aid the tale .,1,train
1778,7539,build Chan 's process chronological sequence drill .,1,train
1640,1833,Nicholson 's unpretentious carrying out is grand .,4,train
27,1972,... mesmerizing merriment and scrumptiously exploitatory .,4,train
680,1780,Quitting offers discriminating domestic help play with spikes of sly sense of humor .,3,train
1485,875,"Hatosy ... portrays pres young Brendan with his common intelligence and subtlety , not to mention a convince brogan .",3,train
1430,4033,"What might have been readily give notice as the tiresome rant of an get on filmmaker still thumbing his pry at pattern takes a surprising , subtle turn at the midway point .",1,train
1157,805,"A Jewish WW II department of commerce that is n't stress just to out-shock , out-outrage or out-depress its potential hearing",2,train
1459,998,"Ratliff 's deuce previous deed , Plutonium Circus and Purgatory County demonstrate his penchant for wry , contentious configurations , and this film is role of that delicate canon .",3,train
636,2073,"deoxyadenosine monophosphate witty , low key romanticistic clowning .",4,train
2405,2685,antiophthalmic factor ceremonious but heartwarming fib .,4,train
1224,5981,zippo more than a run of the mill sue flip .,2,train
2409,8509,... a confuse donkeywork .,1,train
2177,7969,"' Martin Lawrence Live ' is so self-pitying , I nigh require there to be a compendium taken for the comedian at the cease of the show .",0,train
700,2551,angstrom unit violent comedy that could only spring from the crazy mind of the author of Being John Malkovich .,3,train
509,6094,The flick itself look to be course on hypertime in reverse as the in truth funny bits get further and further apart .,1,train
1947,7798,"ii Wild treads to a great extent into Romeo and Juliet West Side Story territory , where it apparently has no business give way .",1,train
325,1370,This is a truly crafted icon that deserves to issue from the traffic jam of holiday moving picture show .,4,train
1538,7831,on that point 's no disguising this as unitary of the spoiled films of the summertime .,0,train
2178,1400,"As shivery and fascinating as Philippe Mora 's new Hitler-study , snide and preconception .",3,train
1666,2499,"giddy , cuter , and light than the first as best iodin retrieve , but still a very good time at the cinema .",4,train
58,7003,"deoxyadenosine monophosphate dull , dense and first derivative repugnance film .",0,train
2433,7171,"Potty-mouthed decent for PG-13 , yet not as hilariously raunchy as South parking lot , this strangely schizo cartoon seems become neither to kids or grownup .",1,train
951,1536,"wish its flaky heroine , it irrigate our person .",3,train
870,4894,"no matter how unwaveringly director john the evangelist Stainton has his tongue in his cheek , the fact clay that a wacky concept does not a movie make .",2,train
577,6247,"Lisa Rinzler 's cinematography may be lovely , but Love Liza 's tale itself nigh crumble into an inhalant blackout , maintaining consciousness just longsighted enough to achieve callow pretentiousness .",1,train
2302,4627,down the stairs is easily below first moment .,0,train
1382,885,The vagabond follow through still when the moving picture does n't .,2,train
1014,4850,"Crudup 's cover presence is the unitary thing that holds interest in the midst of a bathetic , existential exploration of why human race leave their families .",3,train
507,1258,Cho continues her geographic expedition of the stunned define of raunch with considerable vivification .,3,train
1367,6208,... The movie spirit stitched together from stock position and character reference from other motion picture show .,1,train
1727,19,"If you bed record and or verse , then by all stand for check it out .",3,train
1836,6242,zippo about this picture show whole works .,0,train
76,1678,"The tasteful trivial revision works wonders , enhancing the cultural and economic subtext , delivery richer meaning to the narration 's lesson .",3,train
1065,6206,"while we want MacDowell 's character to retrieve her conserve , we have to need whether her personal odyssey trumps the carnage that exact so many lives around her .",2,train
2305,177,This translation does justice department both to robert louis balfour stevenson and to the sci-fi writing style .,3,train
1379,6014,"Green is the comedy tantamount of husayn husayn , and I 'm just about set to go to the U.N. and ask permission for a preemptive strike .",1,train
1132,516,"Methodical , quantify , and gently tedious in its comedy , underground balloting is a purposefully reductive flick -- which may be why it 's so successful at lodging itself in the brain .",4,train
2238,4415,"That 's not time of origin steven spielberg and that , at long last , is minimally hearty .",2,train
2361,4351,"astound is n't the word -- neither is unskilled , incoherent or just apparent irish bull .",0,train
1976,4849,"Jacobi , the most fluent of player , is given comparatively dry material from Nijinsky 's writings to perform , and the visuals , even erotically frank ace , become dullingly insistent .",1,train
1015,3834,"despite an overwrought ending , the motion picture sour as well as it does because of the public presentation .",3,train
275,2143,Another horn blast that there whitethorn be a new mexican Cinema a-bornin ' . ',3,train
742,2186,"s face is chillingly unemotive , nonetheless he put across a enceinte deal in his operation .",2,train
793,7592,"jet ruin every single scene he 's in , and the take , while it 's not completely make for , is seriously compromised by that .",1,train
549,122,Meyjes ' provocative film mightiness be hollo an good example of the stochasticity of evil .,3,train
484,2561,"It all dramatic play out ... like a high-end john the divine Hughes clowning , a form of Elder Bueller 's Time Out .",3,train
1712,1328,angstrom lively and engaging testing of how similar fixation can dominate a kinsfolk .,4,train
884,6920,sir thomas more run down than anything .,1,train
615,7161,How much you are moved by the emotional tumult of Fran office of intelligence support and Mich lupus erythematosus 's relationship depends a mickle on how interesting and likeable you find them .,2,train
2028,1836,another hold rollick from henry m robert Rodriguez .,3,train
992,6923,"... the cause of its whizz , franz joseph kline , to lend some dignity to a dumb story are for cipher .",1,train
2315,6771,vitamin a prolonged bump of psychopathologic pulp magazine .,1,train
977,278,"It is n't that the picture is unfamiliar , but that it wangle to find fresh boulevard of discourse on onetime problems .",2,train
644,530,"If Jaglom 's latest endeavor is not the director at his most twinkle , some of its repartee is stillness worth pick up .",3,train
1946,3823,"The nontextual matter charge and costumes are gorgeous and delicately detail , and Kurys ' charge is clever and insightful .",4,train
1237,429,"Sitting in the third base row of the IMAX cinema at sydney 's Darling Harbour , but single sometimes felt as though single was in the tiny two seater plane that behave the giant camera around Australia , sweeping and gliding , banking and hovering over some of the most not",3,train
1359,1041,"The film is glorious , in truth .",4,train
682,8462,What an plethora .,0,train
1117,4523,It 's not so much a movie as a joint promotion for the national Basketball Association and teen rap and juvenile poster-boy Lil ' Bow belly laugh .,1,train
14,2284,"A full see , a bed story and a murder mystery that expands into a speculation on the deep illusion of innocence .",3,train
499,5856,"For the future , unrivaled hopes mr Plympton will find elbow room for unrivaled more appendage of his little band , a professional screenwriter .",0,train
5,2567,"Famuyiwa 's feature deals with its subject matter in a refined , reasoning style , rather than forcing us to brave out every plot contrivance that the clich -riddled genre can offer .",3,train
1974,1321,"It 's about as convert as any other Arnie musclefest , but has a little too much reverberance with really world events and ultimately comes off as foully simplistic .",1,train
451,294,"A first-class road motion picture that demonstrate you can run away from home , but your ego and all your job xtc with you .",4,train
954,6933,"Everything about Girls golden state n't Swim , level its musical passage of sensitive observation , feels secondhand , intimate -- and not in a good way .",1,train
413,8514,group a reality-snubbing hotchpotch .,1,train
210,2746,This matchless is purely a lightweight dreamer moving picture .,2,train
1495,6332,"While it may not add up to the totality of its parts , Holofcener 's film whirl just enough insight to keep it from being simpleminded , and the ensemble upchuck is pursue enough to keep you from shifting in your chair too often .",3,train
594,4693,"an horrible , purposeless , stupid flick .",0,train
994,22,about the finish take up on a whole other import .,2,train
349,5798,"Got some good , organic character work , lots of obvious political perceptivity and little room for engaging , inventive filmmaking in its nigh deuce 1 deuce - hour , dissipated length .",3,train
1238,2161,much of All around lily Chou-Chou is mesmerizing some of its plaintiveness could make you cry .,4,train
756,1835,"despite its old-hat set-up and predictable plot , conglomerate still has plenty moment to keep it entertaining .",3,train
1524,225,"Stands as peerless of the year 's most intriguing moving picture experiences , letting its imagery speak for it while it forces you to excogitate afresh what a moving picture can be .",4,train
1214,7355,For trip the light fantastic toe completists only .,0,train
559,3362,the like a poor human 's You Can reckon On maine,2,train
1325,5030,overly cagey by about nine-tenths .,3,train
1779,3922,"there 's genuine visual care to the filmmaking , and a strong erotic spark to the most of the essence lip-reading sequence .",3,train
1363,326,"High offence knows the misapprehension that high risk movies make and is determined not to make them , and maybe that is aristocracy of a sort .",2,train
1790,6568,woody grace ethel cecile rosalie allen used to ridicule moving picture like Hollywood finish .,1,train
153,8266,From redden to gushing -- Imamura squirts the screen in ' tender piss Under a ruby red Bridge ',3,train
956,2684,"Evelyn 's secure swan and surehanded direction wee for a come through , heartwarming yarn .",3,train
849,7967,This is an foully inept and contrived examen of grief and its impacts upon the relationships of the subsister .,1,train
285,6847,You crataegus laevigata be galled that you 've ware intimately two hours of your own valued life with this silly little puddle of a movie .,0,train
2461,8125,perfectly and accidentally terrific .,2,train
563,4441,Bigelow offers some sporty twist and turns that at times arm this turgid fable .,3,train
200,8457,astute but otiose .,1,train
2078,3167,"If the plot seems a bit on the skinny side of meat , that 's because panic Room is interested in nix more than sucking you in ... and fix you sweat .",3,train
1082,4922,"find alike the work of someone who may indeed have finally aged past his prime ... and , perhaps more than he actualize , just wants to be care by the people who can still give him work .",1,train
71,6975,"This is n't a wicked photographic film by any means , but it 's too far from being a accomplished work .",2,train
897,4507,"Swinging , the pic seduce it seem , is not a pursuit that pull in the young and fit .",1,train
2044,2932,angstrom mischievous visual fashion and oodles of charm make ' treasure ' a very good but not peachy movie .,3,train
690,8079,The tip thespian plowshare no chemistry or take charisma .,0,train
2039,3520,Kinnear ... gift his best concealment execution with an oddly winning portrayal of unrivaled of life 's ultimate losers .,4,train
476,1035,"information technology 's truly awful and heartbreaking capable matter , but one whose object lesson are well worth revisiting as many times as potential .",3,train
1128,3938,"is many things -- stoner midnight picture , sci-fi deconstructionism , gay fantasia -- but above all it 's a love taradiddle as ruddy as its title .",3,train
1477,5835,than ' Magnifique ' .,2,train
143,1934,"The movie itself is alir from disappointing , propose an original use up on courtroom movies , a few nifty twists that are so crucial to the genre and another first-rate performance by top-billed star robert i Willis .",3,train
2420,1677,A quiet phratry drama with a piddling bit of solicit and a dose of duskiness .,3,train
2132,2988,The events of the celluloid are just so wyrd that iodin honestly never knew what the hell was get along next .,1,train
308,4228,"slog , techy and gimmicky .",1,train
1315,838,"indiana addition to gluing you to the march of your arse , Changing Lanes is besides a film of freshness , imagination and insight .",4,train
522,3076,"This is a movie broad of grace of god and , finally , trust .",4,train
1490,5423,"but a twine of dusty gags , with no good inside dope , and no particular pungency .",1,train
921,5717,It 's so badly wee on every level that I 'm in reality having a tough time believing people were paid to urinate it .,0,train
929,6934,"Feels aimless for lots of its running time , until late in the pic when a tidal undulate of plot arrives , leaving doubt in its wake .",1,train
751,3492,Throws in sufficiency ingenious and unexpected convolute to make water the formula feel fresh .,4,train
1750,6030,"center through the pic , the body fluid dwindle down .",1,train
1406,1508,then graphic a portrait of a woman devour by lust and love and crushed by betrayal that it conjures up the intoxicating fumes and emotional specter of a freshly painted Rembrandt .,4,train
205,3604,"The film undertake the topic of relationship in such a straightforward , emotionally dependable manner that by the end , it 's impossible to ascertain whether the film is , at its core , deeply pessimistic or quietly wannabee .",3,train
482,398,"Yes , but also intriguing and respectable , a worthwhile add on to a discern film bequest .",3,train
2493,3953,"vitamin a a paying attention and unshrinking examination of an choice lifestyle , Sex with Strangers is a success .",3,train
906,2018,"Brims with cacoethes for words , for its freaky , accident prone character , and for the crazy things that keep people going in this crazy life .",4,train
311,167,"saturnine and agitate , yet oblige to picket .",2,train
1036,1076,An intriguing calculate at the French film diligence during the German occupation its most delightful minute come when various lineament express their quirky inner selves .,3,train
481,4844,'' the road pave with ripe purpose steer to the video store '',3,train
1136,2927,"So attractively behave and orchestrate , it 's clear that evergreen state most certainly has a new career ahead of him if he so chooses .",4,train
1087,437,This attractively vivify epic is neer muffle .,4,train
1374,5150,volunteer perfectly nothing unity had n't already reckon .,1,train
1971,2624,"... the story , like Ravel 's bolero , builds to a crescendo that cover many more way than we originate with .",3,train
1387,7638,The corking trick commit by The importance of Being Earnest is the alchemical transmogrification of oscar fingal oflahertie wills wilde into Austen -- and a Hollywood-ized Austen at that .,2,train
2052,6352,"mellisonant gentle redeemer , did the screenwriters just do a cut-and-paste of every forged action-movie line in chronicle",1,train
901,1719,marvellous upchuck and solid execution give all three tale liveliness .,3,train
1437,2659,"The character is a convincing unrivaled , and should give anyone with a sense of right and wrong reason to intermission .",4,train
2128,849,"... plenty of warmth to go some , with music and laugh and the screw of sept .",4,train
270,6455,"According to the script , grant and steer 's grapheme are pee for each other .",3,train
2456,2413,"Not quite as miraculous as its DreamWorks god almighty would have you consider , but it more than adequately fills the heart and fuss the emotions .",3,train
282,7975,detest it because it 's stinking .,0,train
317,5051,"Without a overbold infusion of creativity , 4Ever is neither a prognosticate nor a scourge so a good deal as wishful thinking .",1,train
2359,4049,A wondrous operation by Allison Lohman as an identity-seeking surrogate tyke .,3,train
908,691,"If the film has a trouble , its truncation disappoint You deficiency the story to go on and on .",3,train
2421,3652,"Mike White 's deft compounding of serious bailiwick thing and dark , funny humor get to '' The Good Girl '' a film worth watching .",4,train
2082,6340,hangdog of the worst sinfulness of attributable to a movie comparable this it 's not scarey in the slightest .,0,train
2153,6797,Siegel and co-writers Lisa Bazadona and Grace Woodard have relied too a great deal on convention in create the character reference who border Frankie .,1,train
173,4452,"finally , they will have a face off , but , by then , your senses are as slushy as peas and you do n't care who fires the victorious shot .",0,train
232,4886,"Lots of effort and intelligence are on video display but in capital punishment it is all sticky , stable , and lifeless rumblings .",0,train
2308,4590,"A few nonbeliever may rethink their position when they see the delight the characters choose in this creed , but skeptics are n't likely to enter the theater .",3,train
2270,3773,it leaves piddling doubt that Kidman has get one of our ripe actors .,4,train
1789,4400,Looks more ilk a travel-agency video targeted at people who ilk to rally bikes bare breasted and roll in the mud than a worthwhile coup doeil of independent-community guiding lights .,0,train
154,4161,One can only assume that the panel who bestowed leading Hoffman 's comrade Gordy with the Waldo Salt Screenwriting award at 2002 's Sundance Festival were honoring an attempt to do something different over actually extract it off,1,train
382,7535,The most excruciating 86 bit unity might sit around through this summertime that do not involve a dentist drill .,1,train
1900,192,"Despite its shortcomings , Girls Ca n't drown comprise an charter and intimate first feature by a talented director to watch , and it 's a worthy entry in the french coming-of-age genre .",3,train
2129,6995,"The cinema is grossly contradictory in fetch its societal message , if indeed there is peerless .",1,train
492,223,"No , it 's not as resolved as John Carpenter 's master copy , but it 's sure a lot smarter and more enervate than the sequel .",3,train
1198,8417,one and only shitty flick .,1,train
495,2671,"Like Rudy sensationalistic Lodge , eyre needs to take a good sweat to clear up his cinematic visual sensation before his next creation and remember the lessons of the trickster spider .",0,train
1957,7724,"Kapur fails to contribute his audience a i fictional character worth root for or worth root against , for that matter .",1,train
2245,6900,This low-rent -- and even lower-wit -- rip-off of the Farrelly chum ' oeuvre gets room too soupy -- and in a relatively short amount of clock time .,1,train
2037,3865,But mister Polanski create effigy even more haunting than those in mister spielberg 's 1993 classic .,4,train
1513,8065,... a sooner flat intimacy .,1,train
561,332,Malcolm McDowell is cool off .,3,train
1115,1827,"adenine fresh , obligate play .",4,train
2074,4916,A soulless jumbal of fecklessly assembled cliche and pabulum that plays like a 95-minute commercial for NBA property .,1,train
187,4073,a visually flash but narratively unintelligible and emotionally vapid exercise in style and obfuscation .,1,train
1394,2080,"In other quarrel , it 's just some other sports drama graphic symbol take .",1,train
890,5421,"it 's first rate - fierce , super-serious and super-stupid .",0,train
1710,4424,Really does feeling like a light adulterate out to feature distance .,1,train
448,6368,The colorful Masseur waste product its time on humour rather than devolve on with the inherent absurdity of Ganesh 's rise up the social run .,1,train
1557,6261,technically and artistically tactless .,1,train
2273,7271,"With its lackadaisical plot and mindless litigate , all About the Benjamins evokes the bottom level of blaxploitation flicks from the 1970s .",1,train
1240,2141,samuel Beckett implement to the iranian language voting appendage .,2,train
1751,2417,"Like edward viii Norton in American History X , Ryan gosling Murder aside Numbers fork over a magnetic performance .",4,train
1411,8248,gimmick it ... if you can,3,train
1770,8437,... bibbidy-bobbidi-bland .,0,train
1031,8002,An ill at ease mix of run-of-the-mill begrimed humor and on the face of it earnest personal reflection .,1,train
167,6532,"scorn all the closed door hanky-panky , the moving picture is basically juiceless .",0,train
1531,865,"Broomfield is perk up by Volletta Wallace 's enate fury , her fearlessness , and because of that , his plastic film crackling .",4,train
2016,257,Sch tte 's dramatic snapshot of the creative person three days before his end pop the question an interesting prick of speculation as to the issues Brecht faced as his life drew to a close .,3,train
1000,6690,Viewing this underdramatized but overstated film is like watching a transcript of a therapy school term bring to monotony life sentence by some Freudian puppet .,2,train
1088,3415,viva voce lupus erythematosus opposition,3,train
610,1410,"Everything about The Quiet american language is skilful , exclude its clock .",3,train
2072,7032,The crassness of this extreme right winger thriller is match only by the absurdity of its precede .,1,train
778,8247,bequeath tender your heart without prepare you feel shamed about it .,4,train
879,7226,seraphic Home Alabama for certain wo n't be remembered as one of Witherspoon 's salutary moving picture .,1,train
1208,4170,ennoble chief executive officer 's meet at a countrified retreat and weewee against a tree .,1,train
894,7708,spirant and inelegant in its ' message-movie ' sit .,2,train
649,2457,"expiry to Smoochy is often very amusing , but what 's eventide more remarkable is the integrity of DeVito 's cynical vision .",3,train
