,Unnamed: 0,Sentence,Label,Dataset
1273,2930,"It 's enough to watch Huppert scheme , with her small , intelligent eyes as sweetie as any noir villain , and to enjoy the utterly pitched web of tenseness that Chabrol spins .",3,train
1019,6590,"Squandering his opportunity to piddle absurdist observations , Burns start out hitch up in the rushed of slapstick thoroughfare .",1,train
1168,1576,"It 's something of the ultimate scorsese film , with all the stomach-turning fierceness , colorful New York gang lore and other authentication of his personal cinema painted on their largest-ever historical study .",4,train
971,6099,The problem with movie about angels is they have a trend to shift into meaninglessness .,1,train
898,5118,"If you 're bet for a tarradiddle , do n't pain in the neck .",1,train
114,4530,simply about as sexy and life threatening as an actress in a theatrical role that reminds at every turn of Elizabeth Berkley 's founder dolphin-gasm .,1,train
1235,844,atomic number  lxxviii proceedings it just pizzaz along with vibrance and warmth .,4,train
1133,1308,either a fascinating study of the relationship between mothers and their nestling or a disturbing narrative about sociopaths and their stigmatize .,2,train
926,4338,"It nothingness up moving in many directions as it searches vainly ,  guess for something sweet to say .",1,train
1933,2115,"For once , a picture show does not proclaim the true statement about  love-struck somebodies , but permits them time and space to win over us of that all on their own .",3,train
668,4266,"The telecasting work is so grainy and rough , so qualified on being ' realistic ' rather than carefully lit and set up , that it 's exhausting to lookout .",2,train
148,359,angstrom uproarious comedy fulfill fest that 'll frame hairs on your chest .,3,train
2095,7209,"For a movie about the world power of poesy and passionateness , there is wanted little of either .",1,train
1953,1921,Boasts enough laughable dialog and sharp personation to be gently amusing .,3,train
2483,4114,"psychoanalyse That regurgitates and amniotic fluid down many of the late motion picture show 's successes , with a few new swings thrown in .",2,train
689,3872,"A fun category movie that 's suited for all get on -- a movie that will make you laugh , cry and gain , ' It 's never too late to believe in your dreams . '",4,train
1610,3866,"Steers , in his feature film unveiling , has produce a bright movement picture .",4,train
1607,2314,majuscule sinful film making if you 're in a slap-happy temper .,4,train
269,7383,"forgettable , if large hearted , moving picture .",1,train
162,3972,"amp dry , lovesome revel .",4,train
980,7751,"wherefore '' they '' were here and what '' they '' wanted and rather aboveboard , I did n't caution .",1,train
515,7494,"Once again , the intelligence of mirthful audiences has been grossly underrate , and a substantive plot and well-developed characters have been sacrificed for skin and flare that barely fizzle .",2,train
467,6140,The thought of watching this film with an audience full of teenager fixating on its body temper and reinforcement of stereotypes of which they 'll gravel pile fills me with revulsion .,0,train
90,6796,"A '' Home unique '' film that is spy alike '' Rosemary 's Baby , '' but is not as well-conceived as either of those photographic film .",1,train
735,6947,This pitiable detritus is scarcely an time of day long .,0,train
2406,7696,"Ah , the moil of metropolitan life story",2,train
1713,5332,billy goat Crystal and Robert diamond state Niro somnambulate through vulgarities in a sequel you can decline .,1,train
1377,200,information technology 's a clarence shepard day jr at the beach -- with aerate conditioning and zea mays everta .,3,train
2324,2732,wish a less giddily gorgeous companion to Mr. Wong 's indium the Mood for Love -- very a good deal a Hong Kong movie despite its mainland setting .,2,train
2121,6058,Would that Greengrass had start a shade le for backbone and a lot more for intelligibility .,1,train
489,7238,"wield correctly , wilde 's encounter is a masterpiece of elegant wit and ruse .",4,train
1875,4408,"The son ' spar , like the succession of muck up dumped on Guei , wears down the story 's more cerebral , and sympathetic , plot elements .",2,train
2054,1551,"And thanks to franz joseph kline 's wondrously nuanced performance , that pondering is extremely gratifying .",4,train
2,7312,"... the cast portrays their cartoon counterparts well ... but quite an candidly , Scoob and Shag do n't eat plenty during the moving picture show . '",1,train
1981,4189,"iodin 'm not saying that methamphetamine Age does n't have some fairly reasonably pictures , but there 's not sufficiency substance in the story to actually give them life .",2,train
1753,1124,"Even though it is infused with the sensitivity of a video theater director , it does n't make for completely vacate amusement",2,train
404,3311,Part of the celluloid 's brash charm comes from its time of origin schmalz .,4,train
1494,1204,theater director Brett morgen and Nanette Burstein have put unitedly a bold biographic fantasia .,4,train
341,837,"If anything , the film is doing something of a public service -- shedding light on a group of super talented instrumentalist who might other than go unnoticed and underappreciated by medicine fans .",4,train
2050,4023,"Brutally honest and severalize with sense of humor and poignancy , which makes its content come across .",4,train
2321,4918,"The film 's lack of personality permeates all its facet -- from the TV movie-esque , regard nestling acting to the dullest Irish pub panorama ever filmed .",0,train
1723,1834,As Warren he stumble in search of all the emotion and living experiences he 's miss over the years .,2,train
634,6499,"matchless of those films where the characters inhabit that special annex of hell where adults behave wish banter , shaver behave wish adults and everyone screams at the top of their lungs no matter what the situation .",1,train
2497,7615,"If you are into spill picture show , then you will probably have a reasonably dear time with The Salton sea .",3,train
765,8139,"Further lamentable evidence that Tom Tykwer , director of the resonant and sense-spinning melt down Lola melt down , has work out to be a one-trick pony -- a manufacturer of softheaded metaphysical claptrap .",0,train
2342,4634,"it decline far brusque of verse , but it 's not bad prose .",3,train
1552,4490,but single had a stack of problems with this picture show .,1,train
2150,4085,"cipher here seems as funny as it did in psychoanalyze This , not still Joe Viterelli as De Niro 's right goombah .",1,train
421,674,"A sly female authorization moving picture , although not in a way of life anyone would bear .",3,train
1828,4617,"expand to 65 second for theatrical performance release , it still feels jolly unfinished .",2,train
1173,2898,vitamin a hidden-agenda play that shouts definitive french people nuance .,2,train
1024,8240,"rd sentence 's the entrance ... yea , baby",4,train
351,5477,"at one time Ice-T sting his mug in the windowpane of the couple 's BMW and begins haranguing the wife in badly stage dialogue , all credibility flies out the windowpane .",0,train
2161,501,"And there 's an element of heartbreak to keep an eye on it now , with older and wiser eyeball , because we know what will fall out after henry graham greene 's story ends .",3,train
986,5726,The only amusement you 'll infer from this jerky and sloppy affair will be from unintentional giggles -- various of them .,0,train
42,3204,"inwards its own stagger room , it buzz off to you .",3,train
486,6435,"hug drug , girlfriend , right down the realness drainage .",1,train
449,4276,The dialog is very jerky and monosyllabic contempt the fact that it is being nickname .,1,train
859,5524,"Although ... visually strickle and slickly staged , it 's likewise low temperature , lady jane grey , antiseptic and emotionally desiccated .",1,train
1274,8215,"as well much world power , not plenty pouffe .",1,train
720,6738,"Aside from the fact that the film idiotically uses the website feardotcom.com or the improperly hammy functioning from poor sir leslie stephen Rea , the film gets added reject for the fact that it is well nigh impossible to look at or understand .",0,train
1719,3897,"funnily , the picture is n't nearly as downbeat as it sounds , but strikes a tone that 's alternately melancholic , hopeful and oddly shady .",3,train
774,2083,C'mon,2,train
407,4459,associate in nursing super unpleasant motion picture .,0,train
1416,451,The delivery mustiness have translate like a discarded House beautiful spread .,2,train
1857,5402,"associate in nursing genuinely vague , but ultimately pointless , bailiwick in total pandemonium .",1,train
25,8128,"no matter how much he runs around and acts like a doofus , take on a 50-year-old in the role is creepy in a Michael Jackson kind of room .",1,train
1504,4531,tiddler who are into this Thornberry gormandize will credibly be in wedgie promised land .,3,train
491,1038,"The message of such reflections -- knowing or not -- is that while no fine art raise from a vacuum , many artists live in one .",2,train
535,6143,A grand farting coming from a director get down to resemble someone 's nutcase gallic grandfather .,0,train
1202,3108,"And , there 's no right smart you wo n't be speak about the picture show once you exit the dramatic art .",3,train
1192,5300,The only question ... is to find out how easily the shmaltz is cook up -- to assess the quality of the manipulative engineering .,1,train
770,8541,"We 've seen the hippie-turned-yuppie plot before , but there 's an enthusiastic captivate in Fire that create the expression sassy again .",3,train
2085,7082,"associate in nursing evening more predictable , cliche-ridden endeavour than its precursor .",1,train
1685,6872,"though it pretends to endanger the lifespan of manly hustlers , it 's exploitive without being insightful .",1,train
54,8131,"In his determination to lighten the heavy subject matter , Silberling also , to a sure extent , trivialize the movie with too many nervous quip and flub .",2,train
1851,2539,A small fry film with major delight from Portuguese main Manoel delaware Oliviera ...,4,train
2203,8464,sadly ostentatious .,1,train
1047,712,"Wiseman is patient and sturdy , allow his photographic camera observe and register the lives of women torn apart by a legacy of abuse .",3,train
1699,1112,deucedly uproarious,4,train
2210,4832,guy rope articulate mean thing and shoot a lot of slug .,1,train
276,774,"Efteriades gives the neighborhood -- scene , vibration and all -- the cinematic tantamount of a big , tender bosom .",3,train
295,3963,"Fairy-tale formula , help as a paper skeleton for some very well acting , dialogue , funniness , focus and especially charm .",4,train
2188,4908,"Watching Queen of the goddamned is wish recital a search paper , with special effects tossed in .",1,train
2417,247,angstrom very funny story romantic comedy about two skittish new York middle-agers who stumble into a relationship and then struggle furiously with their fears and idiosyncrasy .,3,train
1332,2829,"If nefarious vampires are your cupful of blood , leaf blade  is definitely a cut above the rest .",3,train
2296,1470,"This charming but slight narration has warmth , brain and interesting graphic symbol compassionately depicted .",3,train
1471,3358,This is the hooey that walter elias disney motion picture are piss of .,3,train
2329,4324,The roleplay is very well but the book is about as interesting as a tape of conversations at the Wal-Mart checkout line .,1,train
342,3908,"Though overall an overwhelmingly positively charged depicting , the film does n't dismiss the more problematic aspects of brownish 's life .",3,train
192,2911,"The underworld urban angst is differential coefficient of Martin Scorsese 's Taxi number one wood and Goodfellas , but this picture address for itself .",3,train
1216,3582,About the best matter you could sound out about Narc is that it 's a rock-solid fiddling genre moving picture show .,3,train
2109,4177,"The joke , and the handwriting , are a amalgamate bagful .",1,train
1973,886,"You 'll jape at either the obviousness of it all or its betise or maybe flush its inventiveness , but the stage is , you 'll jape .",2,train
2088,4794,group a straight-ahead thriller that neer cost increase above shallowness .,1,train
592,5548,not whole lovable -- but what underdog movie since The Bad newsworthiness Bears has been,1,train
1592,5635,"They 're the unnamed , easily substitutable force out that serve as any terror the heroes of repulsion movies hear to avoid .",1,train
35,5743,"The appeal of the vulgar , sexist , racist humour went over my question or -- view just how low forehead it is -- possibly it snuck under my feet .",0,train
1548,2119,"It is an unerasable epic american tarradiddle about two families , one black and one white , facing vary in both their inner and outer lives .",2,train
1125,5929,The real and the product itself are piddling more than mundane .,1,train
104,3089,"overall , matter to as a infotainment -- but not very Imaxy .",2,train
1277,968,land tissue paper .,3,train
273,1448,"With its trace of an awkward Hitchcockian theme in tactfulness , Harmon 's daunting narrative promotes a reasonable landscape of conflict and pathos to reenforcement the scattershot terrorize tone",2,train
1330,6618,"There are a few chuckles , but not a single gag sequence that very score , and the stars seem to be in two unlike moving picture .",2,train
791,1705,The derriere job is the firearm works brightly .,3,train
1670,5724,"an appalling ' mavin Ventura ' rip-off that somehow bring off to bring together Kevin Pollak , one time wrestler Chyna and doll Parton .",0,train
1603,1342,"end Orders nurtures the multi-layers of its characters , allowing us to recollect that life 's at last a gamble and last gild are to be embraced .",4,train
2092,5376,catch barbershop again if you 're in demand of a Cube desex -- this is n't worth sitting through .,1,train
1601,4920,break down could be the worst film a piece has hit about women since valley of the Dolls .,0,train
640,7387,The chateau ... is le concerned with cultural and political issues than doting on its case grapheme .,1,train
2422,7231,And rudolf christian karl diesel is n't the doer to save up it .,1,train
260,7382,"One long , numbing action sequence lay down up more often than not of workaday stuff Yuen has grant us before .",1,train
642,2515,"With so many bad romances out there , this is the kind of moving picture that deserve a opportunity to glow .",3,train
1099,3478,"When compared to the usual , more somber fete entries , Davis ' highly personal brand of romantic comedy is a tart , smart breathing time of fresh air that stands out from the pack tied if the photograph itself is somewhat problematic .",4,train
743,3532,type a gangster picture with the mental ability to surprisal .,3,train
716,3853,"yes , soar upwards .",3,train
293,3703,The film 's desire to be like sometimes undermines the possible action for an exploration of the barbed aspects of the nature nurture contention in regards to homosexuality .,1,train
262,1491,antiophthalmic factor doll click for guy .,2,train
312,2817,"Like microphone is a harmlessly na ve slice of b-ball fantasy , conform to for fulfill in during the rattling NBA 's off-season .",2,train
1537,7571,information technology 's really too earnest -- the crime movie equivalent of a chick film .,2,train
1109,7963,vitamin a fine looking but ultimately pointless political thriller with pot of activity and almost no substance .,2,train
1033,3691,enrich by a inviolable and willing subscribe cast .,4,train
1763,1966,daughter From Danang divulge that crusade toward closure only give new wounds .,1,train
137,6488,Quelle surprisal,2,train
1611,1050,feature film what is surely the risible and most accurate word painting of writer 's parry ever .,4,train
1336,2134,apostle paul cyclooxygenase necessitate to display it .,1,train
115,620,The hot topics of the plot of ground are relegated to the ground -- a welcome step forward from the sally Jesse Raphael aura of films like Philadelphia and American Beauty .,3,train
1882,8502,savorless but harmless .,1,train
909,1129,axerophthol low keyed grind of bed that strikes a very resonant chord .,3,train
667,1920,on that point is sizeableness here .,4,train
1166,2522,"and your pay back will be a serious minded , worked up picture show experience .",4,train
1341,1647,speak articulately about the symbiotic kinship between art and life time .,4,train
1870,7617,The feature-length unfold ... song the register 's conception .,1,train
1279,2755,"while not all that sorry of a movie , it 's nowhere approach as goodness as the original .",1,train
2127,7663,"Girlfriends are speculative , wives are bad and cosset are the buss of death in this bitter Italian comedy .",1,train
1759,4271,"Rifkin no doubt fancies himself something of a Hubert Selby Jr. , but there is n't an apothecaries ounce of true poetry in his entire script it 's only crude and relentlessly exploitative .",0,train
416,4204,Will believably be ace of those motion picture barely registering a blip on the radar screen out of 2002 .,0,train
786,5958,"If all of Eight Legged Freaks was as nurse as the last hour , I would have no problem giving it an incompetent passport .",2,train
633,6380,thus sharply cheery that Pollyana would range for a barf old bag .,1,train
782,1188,This is a superordinate repulsion movie .,4,train
650,3583,Whether you same it or not is essentially a count of sense of taste .,2,train
2269,6265,"name me a cold-hearted curmudgeon for not being able to enjoy a forgetful action movie , but iodin think a movie can be forgetful without being the peak of all things insipid .",0,train
2325,2574,"it is a posture of a infotainment to snub available bias , especially as temptingly easy as it would have been with this premise .",3,train
2298,315,"The finally setting of the moving picture show are anguished , bitter and true .",3,train
771,5234,The threatening breathing in that fuelled DeVito 's early oeuvre is fox in Death to Smoochy into something both ugly and mindless .,0,train
1885,3317,"antiophthalmic factor vivacious , coloured , semimusical interpretation .",4,train
1163,2362,amp smarter and much funnier reading of the old Police honorary society moving picture .,3,train
1708,5823,type a lifetime flick about man .,2,train
1677,5881,"Cox offers plenty of glimpses at existing photos , but there are no movie of Nijinsky , so instead the music director address us to an adrift hodgepodge .",0,train
2348,118,"From the open up var of the Average White set 's '' Pick up the Pieces '' , you can spirit the love .",3,train
1350,7983,revolting .,0,train
360,7389,it 's not too profligate and not too irksome .,3,train
1659,5621,They ought to be a completely mountain scarier than they are in this halfhearted genre put up .,1,train
2355,1671,information technology 's not the least of Afghan disaster that this baronial warlord would be consigned to the dustbin of chronicle .,1,train
1003,3545,The piano teacher is not an tardily shoot .,1,train
1806,7823,"It does n't really know or caution about the grapheme , and uses them as marking for a serial publication of preordained events .",1,train
215,3540,"draw and quarter on an resistless , dreamy romanticism , Byler reveals the ways in which a sultry evening or a beer-fueled afternoon in the sun can inspire even the most retiring heart to stake forth .",4,train
132,7581,Like most movies about the pit of bad behaviour ... lap commence drawn into the party .,1,train
1233,3671,demonstrate a vivid imagination and an telling fashion that leave in some terrific setpieces .,3,train
1400,3077,tied estimable than the foremost ane,4,train
885,37,Their computer-animated front are very expressive .,3,train
2320,5572,"When not wallowing in its characters ' defeat , the movie is busy contrive false , sitcom-worthy resolution to their job .",1,train
1048,4300,"Despite a performance of sustained intelligence from Stanford and some other of subtle humour from Bebe Neuwirth , as an older woman who score Oscar , the film founding father on its lack of empathy for the mixer milieu - rich New York intelligentsia - and its off",2,train
2062,3494,"A real audience-pleaser that will strike a harmonize with anyone who 's of all time waited in a doctor 's office , emergency brake room , hospital bed or insurance fellowship office .",3,train
1962,1986,"spell this gentle and affecting melodrama will have luvvies in raptus , it 's far too cold shoulder and introspective to invoke to anything wider than a niche audience .",2,train
41,32,"It 's not life-affirming -- its crude and base , but unity like it .",2,train
1956,8367,type a absorbing docudrama .,4,train
918,569,"Thanks to surefooted filmmaking and a pair of fascinating carrying into action , the way to that finish is a really special take the air in the woods .",4,train
1150,215,associate in nursing nervy thriller that hand over a surprise punch .,3,train
2135,2600,"every consequence scraunch with tensity , and by the end of the flick , you 're on the edge of your seat .",4,train
1624,6020,It is one more synthetic tribute to the cruelties go through by Southern blacks as distilled through a Caucasian view .,2,train
314,642,Fessenden 's tale is just as a lot about the possession and redefinition of myth as it is about a domestic unit come up their way to joy .,3,train
2358,4005,"This makes Minority Report necessary viewing for sci-fi devotee , as the movie has some of the best exceptional effects of all time .",4,train
796,8361,recall it .,3,train
2431,4895,group a sub-formulaic smack in the aspect to seasonal urge on .,1,train
2193,470,"Hardly an objective documentary , but it 's great cinematic polemicist ... love Moore or abhor him , you 've got to admire ... the intensity with which he 's willing to limited his article of faith .",4,train
1122,5275,Romething 's real legal injury with this ricture,1,train
1388,1710,"Aside from Rohmer 's bold face option regarding point of view , The Lady and the Duke represents the filmmaker 's lifelong concern with formalist experiment in cinematic artistic production .",3,train
225,7851,"Um , no .",2,train
29,577,The film 's intimate camera work and char carrying into action pull us deep into the girls ' confusedness and pain as they shinny tragically to comprehend the chasm of knowledge that 's opened between them .,4,train
620,2465,helium watch out them as they float inside the sea of their personalities .,3,train
2312,5569,but the murder is a dud with the exclusion of about six gags that really work .,2,train
1020,8296,it 's incisively what you 'd anticipate .,2,train
1352,8003,"type a formula kinfolk tearjerker told with a heavy Irish brogue ... accentuating , instead than tone down , the plot 's saccharine thrust .",3,train
1395,5309,information technology 's as if De Palma fatigued an hour set up a fancy table and then served up Kraft macaroni and Cheese .,0,train
761,2730,"angstrom unit affect attempt about the specter of death , particularly suicide .",3,train
695,2064,"entirely befittingly , the tale unfolds like a lazy summertime afternoon and concludes with the crisp limpidity of a fall dawn .",3,train
1290,809,"It wo n't guard up over the long drag , but in the moment , finch 's taradiddle provides the forgettable pleasures of a Saturday matinee .",3,train
2440,918,lupus erythematosus front-loaded and more shapely than the two-hour adaptation release here in 1990 .,2,train
2453,4128,"A inactive and sugary little half-hour , after-school extra about interfaith read , stretched out to  minutes .",2,train
1480,1649,"The audacity to view peerless of william shakspere 's better known calamity as a dark comedy is , by itself , deserving of discourse .",1,train
1595,5604,Gere dedicate a skillful execution in a film that does n't deserve it .,2,train
2283,3894,antiophthalmic factor '' smuggled capital of texas business leader '',2,train
899,3499,... rather proficient at leave some proficient old forge spooks .,3,train
2065,7618,This slender plot flavor peculiarly thin extend over the nearly 80-minute go time .,1,train
1556,4537,"' yes , that 's rightfulness it 's Forrest Gump , saint Of decease . '",3,train
1124,435,An immensely harbor look at some of the unknown heroes of 20th one c pop medicine .,4,train
310,2228,"Like the best of Godard 's motion picture show ... it is visually ravish , interpenetrate , heavy .",4,train
36,7412,The take never get hold its tone and several conniption turn tail too long .,1,train
2278,155,"an enthralling aesthetic experience , ace that 's steeped in mystery and a ravishing , churrigueresco ravisher .",4,train
92,4981,The purity of vacation inspire artificial insemination n't what it used to be .,2,train
286,5975,"As it stand , there 's some delicately sex onscreen , and some tense debate , but not a altogether lot more .",2,train
1672,2524,"Godard has never get to a more sheerly beautiful film than this unexpectedly moving meditation on love , account , retentivity , resistance and artistic superiority .",4,train
1632,4986,"It is supremely unfunny and unentertaining to watch middle-age and older men swallow to excess , piss on sir herbert beerbohm tree , b.s. one some other and arrange on a show in drag .",0,train
988,1257,"While tattoo borrows heavily from both Seven and The Silence of the elia , it manage to maintain both a level of sophisticated intrigue and human-scale characters that fellate the audience in .",4,train
1110,1290,"Daily struggles and simple pleasures take over the preaching content so that , by the time the citation roll across the pat ending , a warm , fuzzy experience prevails .",4,train
